"It can't be human it's too low to the ground. What do you think, Bobo?"
It's not big enough to be a Squatch.
That's what I'm thinking.
"But it makes total sense. If we rule out a human and a baby Sasquatch, Jewpacabra is all we really have left."
But it's supposed to be all yellow-y. My God! This really is proof of a Jewpacabra!
We've never seen this before! It really is true!
'Cause you took the video of this thing. It's not gonna like that.
"What'dya think, Bobo?"
Now what do we do?
Good idea.  Wait wait wait wait. We're gonna need to take the evidence.
