"Well, okay, Mrs. Cartman, I'll legalize 40th trimester abortions for you."
We'll have the pregnancy terminated immediately.
"Why yes, that's what an abortion is."
Adoption?
"Well, that's- pretty different."
"Oh, dear God! Wuh-we have to meet their demands."
My hands are tied. Tell General Lee that I'll meet him in front of the Capitol.
"All right, I'm gonna sign the document declarin' the Confederacy winners of the Civil War."
"Boy, this just keeps getting weirder, doesn't it?"
That's it? I-I don't have to sign this thing?
"Boys, as President of the United States, I want to commend you for stopping the rebel uprising."
"Eh, he's right, boys. Slavery is illegal and immoral, partially in thanks to the North winning the Civil War."
