"Hi kids, I'm Detective Jarvis. I need to ask you all some difficult questions about your school cafeteria chef."
We have some information that all this time Chef has been and still is a pedophile.
Uh huh.
"Yeah, yeah he is so."
"Now, we need some testimony in order to arrest Chef,  so I'm gonna use this doll to ask you kids a few questions. Did Chef ever touch any of you... here?"
"Okay, did he touch you here?"
Did he ever do this? How about this?
Did Chef ever try one of these on for size?
"Young man, will you PLEASE pay attention! This is very important stuff! Ohhh. Ohhhhhh."
