"Oh, yes, I know what you mean."
"I don't know, it ju- it just makes everything taste so...English."
Aaah!  God damn! That little turd bit me!
"Oh I'm so hungry, and all I can think about eating is, eh, brains!"
What's her angle?
"Alright. Well, this better be good."
Pleasure to meet you.
"She's fantastic. How would you like to make a million dollars, baby?"
Let's get started right away.
"Mmp right. Two million, minus your agent's fee, minus your lawyer's fee, minus my fee, and the publicity and taxes taken out, you get three dollars! That's more than most people in your position make, trust me!"
